{
  "$schema": "https://json-schema.org/draft/2020-12/schema",
  "$id": "https://mergesurvivor.studio/kernel/proposal.schema.json",
  "title": "Proposal",
  "description": "How an agent raises a problem it found on its own, rather than waiting to be told. Requiring evidence and a proposed work order is what separates a proposal from a suggestion: the boss triages against something checkable. Open proposals are capped per agent, because an idle agent with no cap generates work to justify its own existence, and that costs real money.",
  "type": "object",
  "additionalProperties": false,
  "required": [
    "id",
    "raisedBy",
    "raisedAt",
    "problem",
    "evidence",
    "proposedWork",
    "expectedBenefit",
    "status"
  ],
  "properties": {
    "id": {
      "$ref": "https://mergesurvivor.studio/kernel/common.schema.json#/$defs/proposalId"
    },
    "raisedBy": {
      "$ref": "https://mergesurvivor.studio/kernel/common.schema.json#/$defs/agentId"
    },
    "raisedAt": {
      "$ref": "https://mergesurvivor.studio/kernel/common.schema.json#/$defs/timestamp"
    },
    "triagedBy": {
      "description": "The boss who ruled on it. Present once triage has happened.",
      "$ref": "https://mergesurvivor.studio/kernel/common.schema.json#/$defs/agentId"
    },
    "problem": {
      "description": "What is wrong, stated as an observation rather than an opinion.",
      "type": "string",
      "minLength": 30
    },
    "evidence": {
      "description": "Evidence records, file paths or seeds that substantiate the problem. A proposal with no evidence is an opinion, and the schema refuses it.",
      "type": "array",
      "minItems": 1,
      "items": {
        "$ref": "https://mergesurvivor.studio/kernel/common.schema.json#/$defs/nonEmptyString"
      }
    },
    "proposedWork": {
      "description": "The concrete change proposed. Vague proposals push the thinking onto the boss, which is the opposite of what a proactive agent is for.",
      "type": "string",
      "minLength": 30
    },
    "expectedBenefit": {
      "$ref": "https://mergesurvivor.studio/kernel/common.schema.json#/$defs/nonEmptyString"
    },
    "estimatedCost": {
      "description": "What acting on this is expected to cost, in the studio's currency. Absent means the proposer could not estimate it, which is itself worth knowing.",
      "$ref": "https://mergesurvivor.studio/kernel/common.schema.json#/$defs/amount"
    },
    "priority": {
      "type": "integer",
      "minimum": 1,
      "maximum": 5
    },
    "status": {
      "type": "string",
      "enum": [
        "open",
        "accepted",
        "rejected",
        "parked",
        "withdrawn"
      ]
    },
    "decision": {
      "description": "The boss's reasoning. Required on rejection: an agent told 'no' with no reason will simply propose it again next week.",
      "$ref": "https://mergesurvivor.studio/kernel/common.schema.json#/$defs/nonEmptyString"
    },
    "taskId": {
      "description": "The work order this became, once accepted.",
      "$ref": "https://mergesurvivor.studio/kernel/common.schema.json#/$defs/taskId"
    },
    "notes": {
      "description": "Limits and questions examined and deliberately NOT proposed as work. Added after the quality director had a durable finding -- an ElapsedSeconds precision limit reached in about 1.5 days of accumulated run time -- that belonged in the record but was not a proposal, and no field could hold it. Without somewhere to put it, such a finding is either dropped or inflated into work nobody needs.",
      "type": "string"
    }
  },
  "allOf": [
    {
      "description": "An accepted proposal becomes a work order, or it was not really accepted.",
      "if": {
        "properties": {
          "status": {
            "const": "accepted"
          }
        },
        "required": [
          "status"
        ]
      },
      "then": {
        "required": [
          "taskId",
          "triagedBy"
        ]
      }
    },
    {
      "description": "A rejection must carry its reasoning, so the same proposal does not return unchanged.",
      "if": {
        "properties": {
          "status": {
            "enum": [
              "rejected",
              "parked"
            ]
          }
        },
        "required": [
          "status"
        ]
      },
      "then": {
        "required": [
          "decision",
          "triagedBy"
        ]
      }
    }
  ]
}
